{
  "$schema": "./schemas/prd-tracker.schema.json",
  "schema_version": "1.0",
  "project": "mac-tool-kit",
  "mode": "local-only",
  "source_of_truth": "repo-json",
  "updated_at": "2026-08-29T22:17:00+08:00",
  "acceptance_policy": {
    "verified_requires": ["automated tests passed", "manual acceptance passed", "source provenance is visible"],
    "numeric_claims": "Measured, provider-reported, derived, estimated, inferred, and unavailable values must never share the same unqualified label.",
    "repo_target": "Core logic coverage above 95 percent and zero linter warnings before a release claim."
  },
  "summary": {
    "overall_status": "release-live-verification-policy-blocked",
    "verdict": "github-release-live-coverage-blocked",
    "prd_items": 5,
    "verified": 0,
    "partial": 5,
    "planned": 0,
    "blocked": 1,
    "not_covered": 0,
    "test_cases": 17,
    "automated_passed": 14,
    "automated_failed": 1,
    "manual_not_covered": 2,
    "coverage_lines_percent": 71.04
  },
  "prd_items": [
    {
      "id": "PRD-DATA-TRUTH",
      "title": "Dashboard data truth audit",
      "status": "partial",
      "priority": "P0",
      "summary": "Truth-safety fixes are implemented and all eight tabs were inspected in the installed app. History rendering is collapsed, indexed and batch-limited; the misleading RAM purge action is removed because macOS purge cannot clear inactive pages. Release status remains blocked only by coverage and unexecuted destructive-action paths.",
      "source_refs": [
        "Sources/MacToolKitCore",
        "Sources/MacDashboardApp",
        "/tmp/mac-dashboard-qa-2026-08-28",
        "/tmp/mac-dashboard-qa-2026-08-29"
      ],
      "acceptance_criteria": [
        "Every displayed number has a named source and freshness timestamp.",
        "Estimated or inferred values are visibly labeled and excluded from factual totals.",
        "Unavailable measurements never masquerade as facts: analytical grids omit empty fields, while safety-critical controls expose an explicit reason and fail closed.",
        "All eight tabs pass automated and manual checks."
      ],
      "test_case_counts": { "total": 10, "passed": 9, "failed": 1, "not_covered": 0 },
      "test_cases": [
        {
          "id": "TC-OVERVIEW-001",
          "status": "verified",
          "use_cases": ["Inspect system overview"],
          "types": ["browser", "visual", "integration"],
          "role": "Mac operator",
          "fixture": "Running /Applications/MacDashboard.app after 2026-08-28 boot",
          "steps": ["Open System Overview", "Compare CPU, RAM, disk, network, Docker, thermal, and fan values with their native sources"],
          "expected": "All summary values match their underlying sources and expose provenance.",
          "automated_status": "passed",
          "manual_status": "passed",
          "evidence": ["Removed the 1800 RPM fallback; unavailable fan readback now displays unavailable.", "Docker stats CPU/RAM is joined by exact container ID with docker ps image, Up/healthy status, runningFor and redacted command.", "The installed System Overview was inspected at 21:44; Docker rows showed real images and Up/healthy states, while fan RPM was labeled actual readback."]
        },
        {
          "id": "TC-AI-001",
          "status": "verified",
          "use_cases": ["Inspect active AI tasks", "Inspect project to main session to subagent hierarchy", "Inspect usage and cost"],
          "types": ["browser", "file", "integration", "hostile-input"],
          "role": "Developer",
          "fixture": "Three active Codex tasks plus local Claude and Antigravity logs",
          "steps": ["Compare Dashboard active sessions with Codex task status", "Inspect parser formulas", "Compare local rollout metadata and token counts", "Inspect parent-child metadata"],
          "expected": "Exact active count, title, cwd, provider-reported tokens, and explicit parent relationship; no invented billing.",
          "automated_status": "passed",
          "manual_status": "passed",
          "evidence": ["Codex rollout metadata supplies exact cwd, provider token total and explicit parent_thread_id; the read-only local turn database supplies the latest exact running state.", "Claude nested subagents use sessionId plus agentId; missing parents remain Unlinked.", "Claude and Antigravity runtime state is cross-checked from matching Mac processes, project CWD, and 30-second provider-log freshness.", "The UI removes actual billing and shows only official-rate API-equivalent estimates. Haiku 4.5 includes distinct cache-read, 5-minute cache-write and 1-hour cache-write rates; OpenAI cached input and cache writes are deducted from the full input subset before pricing.", "At 21:44 the installed Active view showed exactly three Codex inProgress sessions under mac-tool-kit #01a047b9, travian-tools #01a042a1 and hunterest #01a03d16; titles, paths and detail selection matched.", "At 23:44 Recent 24h hid 184 metadata-only provider records by default. Enabling the explicit activity-only toggle showed review-the-current-uncommitted-generic-lovelace as a real Inactive record with ID, path and timestamps, while model/token/cost rows were omitted instead of rendered as unavailable.", "At 00:22 the final installed History view showed 1,228 usage-bearing sessions as collapsed project rows; Hunterest expanded only the first 40 rows and exposed a load-more control for the remaining 405 main sessions. A real new-chat main session with two linked children was expanded and then fully collapsed, including its child paging control."]
        },
        {
          "id": "TC-LAG-001",
          "status": "verified",
          "use_cases": ["Diagnose lag safely"],
          "types": ["browser", "unit", "integration"],
          "role": "Mac operator",
          "fixture": "Dashboard process at 62.8 percent CPU and Docker at 7.7 GB",
          "steps": ["Open Lag Diagnostic", "Compare health verdict with causes and remediation"],
          "expected": "Verdict and remediation severity agree and destructive actions exclude the Dashboard itself.",
          "automated_status": "passed",
          "manual_status": "passed",
          "evidence": ["Major causes cannot produce a Smooth verdict; the Dashboard process is excluded and destructive actions require confirmation.", "A normal 64 GiB memory state no longer turns a 4.9 GiB Docker process into a false Lag cause or termination recommendation.", "The installed Lag page at 21:44 showed Smooth 100 with no contradictory cause or action and explicitly said the rule set cannot exclude every lag source."]
        },
        {
          "id": "TC-CPU-001",
          "status": "verified",
          "use_cases": ["Inspect CPU topology and load"],
          "types": ["browser", "system"],
          "role": "Mac operator",
          "fixture": "Apple M5 Pro with 18 cores",
          "steps": ["Open CPU tab", "Compare per-core labels with sysctl perf levels"],
          "expected": "Core labels reflect the machine topology.",
          "automated_status": "passed",
          "manual_status": "passed",
          "evidence": ["Mach tick load is measured; hw.perflevel groups are labeled as a derived sequential mapping rather than P/E guessing.", "The installed CPU page was inspected with 18 measured core loads and the topology disclosure visible."]
        },
        {
          "id": "TC-MEMORY-001",
          "status": "verified",
          "use_cases": ["Inspect memory usage and pressure", "Understand reclaimable inactive pages"],
          "types": ["browser", "system"],
          "role": "Mac operator",
          "fixture": "64 GB machine with normal operating state",
          "steps": ["Open Memory tab", "Trace used, free, compressed, swap and pressure calculations"],
          "expected": "Derived usage is labeled, inactive pages are explained as system-reclaimable, and no disk-cache command is presented as RAM cleanup.",
          "automated_status": "passed",
          "manual_status": "passed",
          "evidence": ["Usage and pressure are labeled Dashboard-derived; free pages are not called available memory.", "The local purge(8) manual states it only empties disk buffer cache and does not affect anonymous memory, so it cannot clear VM inactive pages.", "All purge controls and Lag purge remediation were removed; the final installed RAM page explicitly labels inactive pages as automatically reclaimable by macOS. Evidence: /tmp/mac-dashboard-qa-2026-08-29/memory-no-purge-final.png."]
        },
        {
          "id": "TC-DISK-NETWORK-001",
          "status": "verified",
          "use_cases": ["Inspect storage and network throughput"],
          "types": ["browser", "system", "hostile-input"],
          "role": "Mac operator",
          "fixture": "en0 received more than 4 GiB since boot",
          "steps": ["Open Disk and Network", "Compare disk capacity", "Exercise 32-bit counter boundary"],
          "expected": "Disk units are explicit and network counters remain monotonic past 4 GiB.",
          "automated_status": "passed",
          "manual_status": "passed",
          "evidence": ["Disk binary units are GiB/MiB.", "Network uses 64-bit NET_RT_IFLIST2 counters and labels cumulative scope as interface totals since boot.", "The installed Disk and Network page was inspected with current rates and since-boot cumulative scope visible."]
        },
        {
          "id": "TC-THERMAL-FAN-001",
          "status": "partial",
          "use_cases": ["Inspect component temperatures", "Control fans safely"],
          "types": ["browser", "system", "security"],
          "role": "Mac operator",
          "fixture": "Fan helper active; helper response available over local socket",
          "steps": ["Open Thermal and Fan tab", "Compare component temperatures with implementation", "Read fan status from helper"],